year,month,day,title,file,Topic,Count,topic_1,topic_2,topic_3,topic_4,date
2023,11,23,Celtic fined for fans displaying Palestinian flag amid Israel-Gaza war,2023-11-23_2142.txt,16,51,football,club,team,cup,2023-11-01
2023,11,24,Nice footballer Atal detained for sharing alleged anti-Semitic content,2023-11-24_2110.txt,16,51,football,club,team,cup,2023-11-01
2023,12,11,Israel’s war forces Palestinian football team Lajee Celtic to stop playing,2023-12-11_1815.txt,16,51,football,club,team,cup,2023-12-01
2023,12,12,Puma to end sponsorship of Israel’s national football team in 2024,2023-12-12_1801.txt,16,51,football,club,team,cup,2023-12-01
2023,12,13,Australia cricketer Khawaja will ‘fight’ to wear Palestine solidarity shoes,2023-12-13_1775.txt,16,51,football,club,team,cup,2023-12-01
2023,12,16,‘No place for genocide’: Qatar football fans stand for Gaza against Israel,2023-12-16_1724.txt,16,51,football,club,team,cup,2023-12-01
2023,12,25,ICC slammed for blocking Australian cricketer’s show of support for Gaza,2023-12-25_1616.txt,16,51,football,club,team,cup,2023-12-01
2023,12,26,Why has cricketer Khawaja been barred from showing solidarity with Gaza?,2023-12-26_1595.txt,16,51,football,club,team,cup,2023-12-01
2024,1,3,Algerian footballer Youcef Atal convicted in France over post on Gaza war,2024-01-03_1518.txt,16,51,football,club,team,cup,2024-01-01
2024,1,8,How a parkour group in Gaza turns war ruins into sporting arenas,2024-01-08_1468.txt,16,51,football,club,team,cup,2024-01-01
2024,1,14,Palestine lose to Iran but win hearts on ‘special night’ at Asian Cup,2024-01-14_1397.txt,16,51,football,club,team,cup,2024-01-01
2024,1,15,Turkey frees Israeli footballer detained over Gaza war reference in match,2024-01-15_1391.txt,16,51,football,club,team,cup,2024-01-01
2024,1,29,‘Sport is part of our resistance’: Palestine football chief Jibril Rajoub,2024-01-29_1236.txt,16,51,football,club,team,cup,2024-01-01
2023,8,30,Mural of killed journalist Shireen Abu Akleh inaugurated in Bethlehem,2023-08-30_3357.txt,17,44,akleh,shireen,abu,her,2023-08-01
2023,10,13,Tens of thousands rally around the world against Israel’s Gaza bombardment,2023-10-13_3158.txt,18,42,protesters,palestine,police,protest,2023-10-01
2023,10,14,Thousands of NYC protesters chant ‘Free Palestine’ amid Israeli bombing,2023-10-14_3131.txt,18,42,protesters,palestine,police,protest,2023-10-01
2023,10,15,Tens of thousands rally around the world in solidarity with Palestine,2023-10-15_3115.txt,18,42,protesters,palestine,police,protest,2023-10-01
2023,10,18,Second day of protests across the Middle East after Gaza hospital strike,2023-10-18_3027.txt,18,42,protesters,palestine,police,protest,2023-10-01
2023,10,21,"London’s ‘March For Palestine’ draws 100,000 demanding Gaza ceasefire",2023-10-21_2940.txt,18,42,protesters,palestine,police,protest,2023-10-01
2023,10,21,Angry Egyptians denounce staged pro-Palestine rallies amid Israel-Hamas war,2023-10-21_2946.txt,18,42,protesters,palestine,police,protest,2023-10-01
2023,10,27,Angela Davis: ‘Palestine is a moral litmus test for the world’,2023-10-27_2799.txt,18,42,protesters,palestine,police,protest,2023-10-01
2023,10,28,New York police arrest hundreds after Israel-Hamas protest at Grand Central,2023-10-28_2784.txt,18,42,protesters,palestine,police,protest,2023-10-01
2023,10,28,"Protests, confrontations in Jerusalem and West Bank amid Israel-Gaza war",2023-10-28_2785.txt,18,42,protesters,palestine,police,protest,2023-10-01
2023,10,29,Thousands continue to march in support of Gaza in multiple cities worldwide,2023-10-29_2749.txt,18,42,protesters,palestine,police,protest,2023-10-01
2023,10,29,Hundreds of thousands march worldwide against Israeli bombardment of Gaza,2023-10-29_2757.txt,18,42,protesters,palestine,police,protest,2023-10-01
2023,11,4,Protesters rally around the world demanding immediate ceasefire in Gaza,2023-11-04_2574.txt,18,42,protesters,palestine,police,protest,2023-11-01
2023,11,7,Jewish New Yorkers occupy Statue of Liberty to demand Israel-Gaza ceasefire,2023-11-07_2522.txt,18,42,protesters,palestine,police,protest,2023-11-01
2023,11,9,"From NYC to Karachi, protesters rally in support of Gaza amid Israeli war",2023-11-09_2470.txt,18,42,protesters,palestine,police,protest,2023-11-01
2023,11,10,"Pro-Palestinian demonstrators blockade military suppliers in UK, US",2023-11-10_2421.txt,18,42,protesters,palestine,police,protest,2023-11-01
2023,11,11,"From Paris to Karachi, protesters rally in support of Palestine",2023-11-11_2396.txt,18,42,protesters,palestine,police,protest,2023-11-01
2023,11,11,Hundreds of thousands rally in London demanding Gaza ceasefire,2023-11-11_2399.txt,18,42,protesters,palestine,police,protest,2023-11-01
2023,11,11,Hundreds of thousands join largest march in London so far against Gaza war,2023-11-11_2401.txt,18,42,protesters,palestine,police,protest,2023-11-01
2023,11,16,US Capitol police clash with protesters calling for Gaza war ceasefire,2023-11-16_2296.txt,18,42,protesters,palestine,police,protest,2023-11-01
2023,11,25,London pro-Palestinian protesters demand permanent Israel-Gaza ceasefire,2023-11-25_2089.txt,18,42,protesters,palestine,police,protest,2023-11-01
2023,11,30,"Worldwide rallies in solidarity with Palestinians, condemning Israel’s war",2023-11-30_2009.txt,18,42,protesters,palestine,police,protest,2023-11-01
2023,12,1,Thousands march for Palestine as Israel and Hamas resume fighting,2023-12-01_1978.txt,18,42,protesters,palestine,police,protest,2023-12-01
2023,12,8,Protesters in Arab countries rally in solidarity with Palestinians in Gaza,2023-12-08_1853.txt,18,42,protesters,palestine,police,protest,2023-12-01
2023,12,9,Tens of thousands again march in London calling for Gaza ceasefire,2023-12-09_1836.txt,18,42,protesters,palestine,police,protest,2023-12-01
2023,12,10,Indonesians rally in support of Palestinians in Gaza,2023-12-10_1834.txt,18,42,protesters,palestine,police,protest,2023-12-01
2023,12,11,"Palestinians strike, protest in occupied West Bank in support of Gaza",2023-12-11_1810.txt,18,42,protesters,palestine,police,protest,2023-12-01
2023,12,11,World condemns Israel’s war on Gaza as it marches for Palestine,2023-12-11_1820.txt,18,42,protesters,palestine,police,protest,2023-12-01
2024,1,6,Pro-Palestine protesters block bridge outside UK parliament,2024-01-06_1483.txt,18,42,protesters,palestine,police,protest,2024-01-01
2024,1,13,Hundreds of thousands rally globally for Gaza on eve of 100 days of war,2024-01-13_1408.txt,18,42,protesters,palestine,police,protest,2024-01-01
2024,1,13,Pro-Palestine protests held around the world as Gaza war nears 100 days,2024-01-13_1409.txt,18,42,protesters,palestine,police,protest,2024-01-01
2024,1,20,"‘Refuse to fight’: Jewish, Arab activists call for peace in Israel’s Haifa",2024-01-20_1332.txt,18,42,protesters,palestine,police,protest,2024-01-01
2024,1,26,Hundreds take to streets in The Hague in solidarity with Palestinians,2024-01-26_1264.txt,18,42,protesters,palestine,police,protest,2024-01-01
2023,6,20,Four Israeli settlers killed in attack in the occupied West Bank,2023-06-20_3498.txt,19,40,settlements,west,bank,settlement,2023-06-01
2023,6,20,UN chief tells Israel to halt illegal settlements in Palestine,2023-06-20_3502.txt,19,40,settlements,west,bank,settlement,2023-06-01
2023,6,26,Israel approves plans for thousands of illegal settlement homes,2023-06-26_3480.txt,19,40,settlements,west,bank,settlement,2023-06-01
2023,7,1,"Australia, Canada, UK ‘deeply concerned’ over Israeli settlements",2023-07-01_3471.txt,19,40,settlements,west,bank,settlement,2023-07-01
2023,7,14,Israel sets record for illegal settlement approvals: Rights group,2023-07-14_3422.txt,19,40,settlements,west,bank,settlement,2023-07-01
2023,8,8,Israeli minister dismisses US ‘terror’ label after deadly settler attack,2023-08-08_3386.txt,19,40,settlements,west,bank,settlement,2023-08-01
2023,8,22,"New York Mayor Eric Adams meets with Netanyahu, protest leaders in Israel",2023-08-22_3369.txt,19,40,settlements,west,bank,settlement,2023-08-01
2023,9,13,What were the Oslo Accords between Israel and the Palestinians?,2023-09-13_3341.txt,19,40,settlements,west,bank,settlement,2023-09-01
2023,11,27,Israel-Palestine conflict: A brief history in maps and charts,2023-11-27_2069.txt,19,40,settlements,west,bank,settlement,2023-11-01
2023,12,5,US announces visa bans after warning Israel on West Bank settler violence,2023-12-05_1908.txt,19,40,settlements,west,bank,settlement,2023-12-01
2023,12,9,Can US visa bans deter West Bank violence by Israeli settlers?,2023-12-09_1846.txt,19,40,settlements,west,bank,settlement,2023-12-01
2023,12,11,EU mulls sanctions on violent Israeli settlers in occupied West Bank,2023-12-11_1804.txt,19,40,settlements,west,bank,settlement,2023-12-01
2023,6,5,"US report on Abu Akleh killing must be made public, senator urges",2023-06-05_3524.txt,20,40,akleh,abu,investigation,shireen,2023-06-01
2023,7,18,US groups demand Abu Akleh probe via Justice for Shireen Act,2023-07-18_3416.txt,20,40,akleh,abu,investigation,shireen,2023-07-01
2023,10,21,Limited aid enters Gaza as Israeli bombing compounds dire situation,2023-10-21_2941.txt,21,36,aid,food,trucks,gaza,2023-10-01
2023,10,21,Can a humanitarian catastrophe in Gaza be averted?,2023-10-21_2949.txt,21,36,aid,food,trucks,gaza,2023-10-01
2023,10,23,Israel-Hamas war: Which countries have sent aid to Gaza so far?,2023-10-23_2909.txt,21,36,aid,food,trucks,gaza,2023-10-01
2023,10,24,"More than 700 killed in overnight Israeli attacks, Gaza officials say",2023-10-24_2877.txt,21,36,aid,food,trucks,gaza,2023-10-01
2023,10,25,Why Israel’s ban on fuel to Gaza isn’t about stopping Hamas,2023-10-25_2867.txt,21,36,aid,food,trucks,gaza,2023-10-01
2023,10,26,Red Cross’s Mamadou Sow: ‘I wish we could shield hospitals in Gaza’,2023-10-26_2837.txt,21,36,aid,food,trucks,gaza,2023-10-01
2023,10,29,"Palestinians break into Gaza UN aid warehouses as toll tops 8,000",2023-10-29_2756.txt,21,36,aid,food,trucks,gaza,2023-10-01
2023,11,2,Gaza bakeries targeted and destroyed by Israeli air attacks,2023-11-02_2632.txt,21,36,aid,food,trucks,gaza,2023-11-01
2023,11,4,Will Gaza ever receive enough aid?,2023-11-04_2585.txt,21,36,aid,food,trucks,gaza,2023-11-01
2023,11,8,Red Cross ‘deeply troubled’ as aid convoy attacked in Gaza City,2023-11-08_2495.txt,21,36,aid,food,trucks,gaza,2023-11-01
2023,11,13,"Palestinians face food, water shortages in southern Gaza",2023-11-13_2358.txt,21,36,aid,food,trucks,gaza,2023-11-01
2023,11,17,‘Minimal’ fuel to be allowed into Gaza after UN warns of starvation risk,2023-11-17_2258.txt,21,36,aid,food,trucks,gaza,2023-11-01
2023,11,17,More than 20 patients die at Gaza’s al-Shifa Hospital amid Israeli raid,2023-11-17_2260.txt,21,36,aid,food,trucks,gaza,2023-11-01
2023,11,24,UN agencies hope truce will allow aid into northern Gaza,2023-11-24_2119.txt,21,36,aid,food,trucks,gaza,2023-11-01
2023,11,25,Palestinians stock up on essentials amid surge in Gaza food prices,2023-11-25_2092.txt,21,36,aid,food,trucks,gaza,2023-11-01
2023,11,25,‘To make lives easier’: Aid brings relief in Gaza amid Israel-Hamas truce,2023-11-25_2099.txt,21,36,aid,food,trucks,gaza,2023-11-01
2023,11,29,Israel-Hamas truce: How much aid has entered Gaza?,2023-11-29_2031.txt,21,36,aid,food,trucks,gaza,2023-11-01
2023,12,9,Palestinians displaced to south Gaza’s overcrowded areas living on streets,2023-12-09_1842.txt,21,36,aid,food,trucks,gaza,2023-12-01
2023,12,11,UN envoys say ‘enough’ to Israel-Hamas war on trip to Gaza border,2023-12-11_1805.txt,21,36,aid,food,trucks,gaza,2023-12-01
2023,12,12,New Israeli border inspection point for Gaza aid won’t solve Rafah backlog,2023-12-12_1797.txt,21,36,aid,food,trucks,gaza,2023-12-01
2023,12,17,Starving Palestinians scramble for aid as desperation mounts in Gaza,2023-12-17_1707.txt,21,36,aid,food,trucks,gaza,2023-12-01
2023,12,18,Israel-Hamas war updates: Hamas ‘open to any initiative’ on prisoner swap,2023-12-18_1704.txt,21,36,aid,food,trucks,gaza,2023-12-01
2023,12,23,Famine by February: How bad is Gaza’s hunger crisis under Israeli attacks?,2023-12-23_1634.txt,21,36,aid,food,trucks,gaza,2023-12-01
2023,12,29,Tens of thousands forced to flee again as Israel expands Gaza offensive,2023-12-29_1562.txt,21,36,aid,food,trucks,gaza,2023-12-01
2024,1,18,"Aid for Israeli captives, Palestinians reaches Gaza despite challenges",2024-01-18_1359.txt,21,36,aid,food,trucks,gaza,2024-01-01
2023,12,13,"UN’s Philippe Lazzarini: Gaza’s agony – hungry, forsaken, dehumanised",2023-12-13_1785.txt,22,35,unrwa,funding,agency,refugees,2023-12-01
2023,12,25,Israel denies visas to UN staff as it hits back against Gaza war criticism,2023-12-25_1608.txt,22,35,unrwa,funding,agency,refugees,2023-12-01
2024,1,26,UNRWA probes employees over suspected involvement in October 7 attack,2024-01-26_1265.txt,22,35,unrwa,funding,agency,refugees,2024-01-01
2024,1,27,Palestinians condemn suspension of UNRWA funding by Western nations,2024-01-27_1252.txt,22,35,unrwa,funding,agency,refugees,2024-01-01
2024,1,29,"Israeli intelligence accuses UNRWA staff of kidnap, seizing body",2024-01-29_1230.txt,22,35,unrwa,funding,agency,refugees,2024-01-01
2024,1,31,UN chief says UNRWA is ‘backbone’ of Gaza aid response,2024-01-31_1215.txt,22,35,unrwa,funding,agency,refugees,2024-01-01
2024,1,31,Defunding UNRWA is worse than collective punishment,2024-01-31_1216.txt,22,35,unrwa,funding,agency,refugees,2024-01-01
2024,1,31,What’s behind Israel’s decision to target UNRWA?,2024-01-31_1217.txt,22,35,unrwa,funding,agency,refugees,2024-01-01
2023,10,9,‘Israel doesn’t care about collateral damage’: Bunker busters used in Gaza,2023-10-09_3269.txt,23,33,tunnels,tunnel,hamas,be,2023-10-01
2023,10,10,Analysis: Is Hamas a more sophisticated force than Israel imagined?,2023-10-10_3235.txt,23,33,tunnels,tunnel,hamas,be,2023-10-01
2023,10,11,Analysis: Why did it take Israel three days to return to Gaza’s boundary?,2023-10-11_3227.txt,23,33,tunnels,tunnel,hamas,be,2023-10-01
2023,10,13,Analysis: Israel’s Gaza invasion could test its occupation of the West Bank,2023-10-13_3147.txt,23,33,tunnels,tunnel,hamas,be,2023-10-01
2023,10,14,"Analysis: Propaganda, deception, and fake news in the Israel-Hamas conflict",2023-10-14_3124.txt,23,33,tunnels,tunnel,hamas,be,2023-10-01
2023,10,16,Analysis: Israel’s deadlines to Gaza’s Palestinians have failed,2023-10-16_3083.txt,23,33,tunnels,tunnel,hamas,be,2023-10-01
2023,10,18,Analysis: Will Gaza be Israel’s Stalingrad?,2023-10-18_3038.txt,23,33,tunnels,tunnel,hamas,be,2023-10-01
2023,10,20,How Israel will stage its land incursion into Gaza,2023-10-20_2965.txt,23,33,tunnels,tunnel,hamas,be,2023-10-01
2023,10,25,Analysis: Why hasn’t Israel launched a ground invasion of Gaza yet?,2023-10-25_2848.txt,23,33,tunnels,tunnel,hamas,be,2023-10-01
2023,10,26,Analysis: What does Israel’s Gaza incursion propaganda video reveal?,2023-10-26_2826.txt,23,33,tunnels,tunnel,hamas,be,2023-10-01
2023,10,28,"Analysis: Israel’s ground attacks yield lots of bang, little success",2023-10-28_2764.txt,23,33,tunnels,tunnel,hamas,be,2023-10-01
2023,11,5,Analysis: Israel’s ground war in Gaza could get much bloodier,2023-11-05_2569.txt,23,33,tunnels,tunnel,hamas,be,2023-11-01
2023,11,6,Analysis: Hamas’s asymmetric warfare against Israel – lessons from Ukraine,2023-11-06_2535.txt,23,33,tunnels,tunnel,hamas,be,2023-11-01
2023,11,8,Analysis: How would Israel fare in Gaza’s tunnels?,2023-11-08_2497.txt,23,33,tunnels,tunnel,hamas,be,2023-11-01
2023,11,9,"Analysis: How would Israel find, map, take and keep Gaza’s tunnels?",2023-11-09_2453.txt,23,33,tunnels,tunnel,hamas,be,2023-11-01
2023,11,13,‘Very risky’: Israel faces months-long campaign against Hamas Gaza tunnels,2023-11-13_2371.txt,23,33,tunnels,tunnel,hamas,be,2023-11-01
2023,11,15,Analysis: Israel’s ‘war on hospitals’ vs Hamas military exaggerations,2023-11-15_2326.txt,23,33,tunnels,tunnel,hamas,be,2023-11-01
2023,11,17,Analysis: What’s Israel’s next target after Gaza’s al-Shifa Hospital?,2023-11-17_2272.txt,23,33,tunnels,tunnel,hamas,be,2023-11-01
2023,11,20,What Israel’s video of ‘Hamas tunnel’ under al-Shifa tells us,2023-11-20_2203.txt,23,33,tunnels,tunnel,hamas,be,2023-11-01
2023,11,21,Analysis: How Israel could gain from a pause in the Gaza war,2023-11-21_2194.txt,23,33,tunnels,tunnel,hamas,be,2023-11-01
2023,11,22,Analysis: A pause in fighting – what’s in it for Hamas?,2023-11-22_2167.txt,23,33,tunnels,tunnel,hamas,be,2023-11-01
2023,11,29,Analysis: Why extending the Israel-Hamas truce won’t be easy,2023-11-29_2015.txt,23,33,tunnels,tunnel,hamas,be,2023-11-01
2023,12,2,"US sends ‘bunker buster’ bombs to Israel for war on Gaza, report says",2023-12-02_1968.txt,23,33,tunnels,tunnel,hamas,be,2023-12-01
2023,12,3,"Analysis: Israel resumed bombing Gaza, what has happened since?",2023-12-03_1953.txt,23,33,tunnels,tunnel,hamas,be,2023-12-01
2023,12,7,Is Israel’s Gaza War the most destructive yet with conventional weapons?,2023-12-07_1874.txt,23,33,tunnels,tunnel,hamas,be,2023-12-01
2023,12,8,"Will Netanyahu risk a tunnel conflict to ‘eradicate Hamas’, stay in power?",2023-12-08_1871.txt,23,33,tunnels,tunnel,hamas,be,2023-12-01
2023,12,11,Analysis: Has the approach to tunnel warfare changed for Israel and Hamas?,2023-12-11_1813.txt,23,33,tunnels,tunnel,hamas,be,2023-12-01
2023,12,17,Analysis: Why Israel will continue its deadly push into Gaza city centres,2023-12-17_1714.txt,23,33,tunnels,tunnel,hamas,be,2023-12-01
2023,12,18,Captives mistakenly killed by Israeli troops left SOS signs in Hebrew,2023-12-18_1696.txt,23,33,tunnels,tunnel,hamas,be,2023-12-01
2023,12,21,Analysis: Why is Israel’s military killing so many of its own?,2023-12-21_1657.txt,23,33,tunnels,tunnel,hamas,be,2023-12-01
2023,12,31,Israeli bombardment destroyed over 70% of Gaza homes: Report,2023-12-31_1550.txt,23,33,tunnels,tunnel,hamas,be,2023-12-01
2024,1,8,Israel says it is scaling down north Gaza operations. What does that mean?,2024-01-08_1469.txt,23,33,tunnels,tunnel,hamas,be,2024-01-01
2023,6,22,Israeli army uses force against Druze protests in occupied Golan,2023-06-22_3492.txt,24,33,rockets,israeli,gaza,in,2023-06-01
2023,10,7,"Buzzing Tel Aviv’s streets empty, as Israel-Hamas conflict escalates",2023-10-07_3300.txt,24,33,rockets,israeli,gaza,in,2023-10-01
2023,10,7,What happened in Israel? A breakdown of how Hamas attack unfolded,2023-10-07_3301.txt,24,33,rockets,israeli,gaza,in,2023-10-01
2023,10,7,Israel army launches air attacks on Gaza,2023-10-07_3305.txt,24,33,rockets,israeli,gaza,in,2023-10-01
2023,10,7,Scenes from Hamas’s morning rocket attack on Israel,2023-10-07_3308.txt,24,33,rockets,israeli,gaza,in,2023-10-01
2023,10,8,"Israel declares state of war, attacks on Gaza intensify",2023-10-08_3291.txt,24,33,rockets,israeli,gaza,in,2023-10-01
2023,10,26,Israel stages large overnight ground raid into Gaza Strip,2023-10-26_2841.txt,24,33,rockets,israeli,gaza,in,2023-10-01
2023,10,29,Angry crowd storms Russia’s Dagestan airport to protest flight from Israel,2023-10-29_2742.txt,24,33,rockets,israeli,gaza,in,2023-10-01
2023,10,30,Russia blames Ukraine and the West for Dagestan airport unrest,2023-10-30_2723.txt,24,33,rockets,israeli,gaza,in,2023-10-01
2024,1,15,Israel’s war on Gaza updates: Israeli attacks kill 25 overnight in Gaza,2024-01-15_1396.txt,24,33,rockets,israeli,gaza,in,2024-01-01
2023,7,11,Israel expels Sub Labans from their home in Jerusalem’s Old City,2023-07-11_3430.txt,25,33,jerusalem,jarrah,sheikh,east,2023-07-01
2024,1,16,Palestinian village fears Israel wartime demolitions,2024-01-16_1381.txt,25,33,jerusalem,jarrah,sheikh,east,2024-01-01
2023,10,13,Israel-Hamas war updates: Iran tells Israel to stop before ‘it’s too late’,2023-10-13_3138.txt,26,32,updates,closed,page,live,2023-10-01
2023,10,13,Israel-Hamas updates: Thousands flee as Israel starts ground raids in Gaza,2023-10-13_3174.txt,26,32,updates,closed,page,live,2023-10-01
2023,10,21,Israel-Hamas war updates: Hamas says repelled ground attack in Gaza,2023-10-21_2937.txt,26,32,updates,closed,page,live,2023-10-01
2023,11,2,Israel-Hamas war updates: Israel says its forces surround Gaza City,2023-11-02_2655.txt,26,32,updates,closed,page,live,2023-11-01
2023,11,3,Israel-Hamas war updates: Israeli strike hits Gaza medical convoy,2023-11-03_2625.txt,26,32,updates,closed,page,live,2023-11-01
2023,11,4,Israel-Hamas war updates: Israeli air strikes pound Gaza as troops encircle,2023-11-04_2572.txt,26,32,updates,closed,page,live,2023-11-01
2023,11,6,Israel-Hamas war live updates: Gaza hospital on brink of shutting down,2023-11-06_2555.txt,26,32,updates,closed,page,live,2023-11-01
2023,11,7,Israel-Hamas war updates: Israeli leaders vow to keep up Gaza bombardments,2023-11-07_2527.txt,26,32,updates,closed,page,live,2023-11-01
2023,11,8,Israel-Hamas war updates: UN rights chief warns of Gaza ‘living nightmare’,2023-11-08_2501.txt,26,32,updates,closed,page,live,2023-11-01
2023,11,11,Israel-Gaza war live: Israeli tanks 20 metres from al-Quds hospital,2023-11-11_2414.txt,26,32,updates,closed,page,live,2023-11-01
2023,11,15,Israel-Hamas war updates: Israel raids Gaza’s al-Shifa Hospital,2023-11-15_2332.txt,26,32,updates,closed,page,live,2023-11-01
2023,11,16,Israel-Hamas war updates: Gaza hospitals buckle under Israeli attacks,2023-11-16_2304.txt,26,32,updates,closed,page,live,2023-11-01
2023,11,17,Israel-Hamas war updates: Aid groups warn Israel’s siege strangling Gaza,2023-11-17_2276.txt,26,32,updates,closed,page,live,2023-11-01
2023,11,21,Israel-Hamas war updates: Israeli gov’t meets to vote on Gaza truce deal,2023-11-21_2198.txt,26,32,updates,closed,page,live,2023-11-01
2023,11,23,"Israel-Hamas war updates: Israel bombs UN school, killing ‘at least 27’",2023-11-23_2154.txt,26,32,updates,closed,page,live,2023-11-01
2023,11,24,Israel-Hamas war updates: First Palestinians released from Israeli prisons,2023-11-24_2130.txt,26,32,updates,closed,page,live,2023-11-01
2023,11,27,"Israel-Hamas war updates: 33 Palestinians, 11 Israelis released",2023-11-27_2075.txt,26,32,updates,closed,page,live,2023-11-01
2023,11,29,Israel-Hamas war updates: Ten more Israeli captives released in Gaza,2023-11-29_2035.txt,26,32,updates,closed,page,live,2023-11-01
2023,12,14,"Israel-Hamas war updates: Netanyahu thanks US for support, weapons",2023-12-14_1772.txt,26,32,updates,closed,page,live,2023-12-01
2023,12,15,Israel-Hamas war updates: Israeli attack kills Al Jazeera’s Samer Abudaqa,2023-12-15_1753.txt,26,32,updates,closed,page,live,2023-12-01
2023,12,19,Israel-Hamas war updates: US holds up UN vote on Gaza truce,2023-12-19_1692.txt,26,32,updates,closed,page,live,2023-12-01
2023,12,25,"Israel-Hamas war updates: ‘We are not stopping,’ vows PM Netanyahu",2023-12-25_1618.txt,26,32,updates,closed,page,live,2023-12-01
2023,12,27,"Israel-Hamas war updates: Israel, Turkey in war of words",2023-12-27_1592.txt,26,32,updates,closed,page,live,2023-12-01
2023,12,28,Israel-Hamas war updates: Children among dead as Israeli strike hits Rafah,2023-12-28_1580.txt,26,32,updates,closed,page,live,2023-12-01
2023,7,8,Why the Western media lied about Israel’s Jenin siege,2023-07-08_3439.txt,27,32,and,is,not,of,2023-07-01
2023,10,13,"Israel is losing its value as an ally for the West, Arab states",2023-10-13_3150.txt,27,32,and,is,not,of,2023-10-01
2023,10,18,Rethinking Palestine-Israel: Hegemonic security vs true justice,2023-10-18_3029.txt,27,32,and,is,not,of,2023-10-01
2023,10,19,Erasing Palestine,2023-10-19_2999.txt,27,32,and,is,not,of,2023-10-01
2023,10,24,Israel’s war of self-deceit,2023-10-24_2878.txt,27,32,and,is,not,of,2023-10-01
2023,10,31,Where is the ‘responsibility to protect’ in Gaza?,2023-10-31_2696.txt,27,32,and,is,not,of,2023-10-01
2023,11,1,"Against the ‘Denkverbot’: If you cancel Palestine, cancel us",2023-11-01_2666.txt,27,32,and,is,not,of,2023-11-01
2023,11,5,Why Israel wants to erase context and history in the war on Gaza,2023-11-05_2563.txt,27,32,and,is,not,of,2023-11-01
2023,11,9,"Israel’s war crimes in Gaza are by design, not default",2023-11-09_2452.txt,27,32,and,is,not,of,2023-11-01
2023,11,10,"Why is Israel bombing Gaza hospitals, ambulances? It’s all about ‘winning’",2023-11-10_2437.txt,27,32,and,is,not,of,2023-11-01
2023,11,11,"Q&A: Bali bomber on crime, punishment, and what motivated deadly attack",2023-11-11_2413.txt,27,32,and,is,not,of,2023-11-01
2023,11,12,Genocide in Gaza: A call to urgent global action,2023-11-12_2390.txt,27,32,and,is,not,of,2023-11-01
2023,12,10,How international law is used to cover up Israeli settler-colonialism,2023-12-10_1831.txt,27,32,and,is,not,of,2023-12-01
2023,12,12,How Arab eco-normalisation of Israel covers up its crimes,2023-12-12_1795.txt,27,32,and,is,not,of,2023-12-01
2023,12,13,Christmas cancelled: US Palestinians feel no holiday joy amid war on Gaza,2023-12-13_1776.txt,27,32,and,is,not,of,2023-12-01
2023,12,23,Israel says Gaza war is like WWII. Experts say it’s ‘justifying brutality’,2023-12-23_1635.txt,27,32,and,is,not,of,2023-12-01
2024,1,12,"From a Palestinian in Gaza, thank you South Africa!",2024-01-12_1428.txt,27,32,and,is,not,of,2024-01-01
2023,10,10,"Harvard students blame ‘apartheid regime’ for Israel-Gaza war, alumni react",2023-10-10_3255.txt,28,30,faculty,cornell,university,staff,2023-10-01
2023,10,17,Tensions surge at US universities as students rally over Israel-Hamas war,2023-10-17_3055.txt,28,30,faculty,cornell,university,staff,2023-10-01
2023,11,1,US rights group urges colleges to protect free speech amid Israel-Gaza war,2023-11-01_2656.txt,28,30,faculty,cornell,university,staff,2023-11-01
2023,11,2,‘Career on the line’: US students fear job backlash for protesting Israel,2023-11-02_2626.txt,28,30,faculty,cornell,university,staff,2023-11-01
